{
  "name": "hello",
  "description": "Example plugin that echoes structured input.",
  "version": "0.1.0",
  "actions": {
    "echo": {
      "description": "Echo PLUGIN_ARGS_JSON as JSON output.",
      "command": "./scripts/echo.sh",
      "timeout_ms": 10000,
      "output": "json",
      "input_schema": {
        "type": "object",
        "additionalProperties": true
      }
    }
  }
}
